"","name","thumbnail","url","ghuser","ghrepo","tags","cran","ghauthor","short","description"
"117","ggpie","images/ggpie.png","https://github.com/showteeth/ggpie","showteeth","ggpie","visualization,general,pie,donut,rose pie","true","showteeth","Create pie and donut plot using `ggplot2`.","`ggpie` aims to create **pie (2D and 3D)**, **donut** and **rose pie** plot with the `ggplot2` plotting system which implemented the grammar of graphics. It contains four main functions:1. `ggpie`"
"118","ggstar","images/ggstar.png","https://github.com/xiangpin/ggstar","xiangpin","ggstar","visualization, different shape points","true","xiangpin","Multiple Geometric Shape Point Layer for 'ggplot2'","To create the multiple polygonal point layer for easily discernible shapes,we developed the package, it is like the 'geom_point' of 'ggplot2'."
"119","ggarchery","images/ggarchery.png","https://github.com/mdhall272/ggarchery","mdhall272","ggarchery","visualization, arrows","true","mdhall272","Flexible segment geoms with arrows for 'ggplot2'","Enhanced arrow segments for control of the position of the arrowhead on the line, multiple arrowheads, and shrinkage of segments to prevent arrows colliding with their 'targets' without alterations to coordinates"
"120","tidyterra","images/tidyterra.png","https://github.com/dieghernan/tidyterra","dieghernan","tidyterra","visualization, raster, spatial","true","dieghernan","'ggplot2' geoms for  'terra' rasters and vectors","'geom_' functions that provide a convenient way of visualizing SpatRastersand SpatVectors generated with the 'terra' package."
"121","ggseqplot","images/ggseqplot.png","https://maraab23.github.io/ggseqplot","maraab23","ggseqplot","visualization,sequence analysis","true","maraab23","'ggseqplot' renders sequence plots using ggplot2.","'ggseqplot' provides a set of functions that reproduce some of the sequence plots from 'TraMineR::seqplot' and 'TraMineRextras' using 'ggplot2'. These plots are produced on the basis of a sequence object defined with 'TraMineR::seqdef'. The package automates the reshaping and plotting of sequence data. Resulting plots are of class ggplot, i.e. components can be added and tweaked using '+' and regular ggplot2 functions."
"122","ggsurvfit","images/ddsjoberg-ggsurvfit.png","http://www.danieldsjoberg.com/ggsurvfit/","ddsjoberg","ggsurvfit","visualization,survival,statistics","true","ddsjoberg","Flexible Time-to-Event Figures","Ease the creation of time-to-event (i.e. survival) endpointfigures. The modular functions create figures ready for publication.Each of the functions that add to or modify the figure are written asproper 'ggplot2' geoms or stat methods, allowing the functions fromthis package to be combined with any function or customization from'ggplot2' and other 'ggplot2' extension packages."
"123","ggsector","images/ggsector.png","https://github.com/yanpd01/ggsector","yanpd01","ggsector","visualization, geoms, sector, fan","true","yanpd01","Create sector plots using `ggplot2`.","`ggsector` provides a new geom, `geom_sector()`, a grid-based layerfunction that conforms to the `ggplot2` layer syntax.`ggsector` mainly provides two sector drawing modes, one is to draw sectorsbased on `draw_panel` when `individual = FALSE`, and the other is to drawsectors based on `draw_group` when `individual = TRUE`."
"124","ggterror","images/mivalek-ggterror.png","https://github.com/mivaek/ggterrorbar","mivalek","ggterrorbar","visualization, geoms","false","mivalek","Create T-errorbars like in THAT paper","`ggterror` provides a new geom, `geom_terrorbar()` that swaps errorbars for the letter Tjust like they did in the now retracted legendary paper from July 2022 special issue ofHindawi's journal Advances in Materials Science and Engineering."
"125","ggragged","images/mikmart-ggragged.png","https://mikmart.github.io/ggragged/","mikmart","ggragged","facets","true","mikmart","Facets for panel layouts with ragged edges","`ggragged` adds new facets to group panels in rows or columns of(potentially) varying widths, creating panel layouts with ragged edges."
"126","ggmapinset","images/ggmapinset.png","https://cidm-ph.github.io/ggmapinset/","cidm-ph","ggmapinset","visualization,spatial","true","arcresu","Add zoomed inset panels to your ggplot maps","Helper to add insets based on `geom_sf()` from 'ggplot2'. This package gives you adrop-in replacement for `geom_sf()` that supports adding a zoomed inset map withouthaving to create and embed a separate plot."
"127","ggmagnify","images/hughjonesd-ggmagnify.png","https://github.com/hughjonesd/ggmagnify","hughjonesd","ggmagnify","visualization,geoms,inset,zoom,magnification","false","hughjonesd","Create a magnified inset of part of a ggplot object. ","ggmagnify creates a magnified inset of part of a ggplot object. Borders can be drawn around the target area and the inset, along with projection lines from one to the other. The inset can have a drop shadow. The magnified area can be a rectangle, an ellipse or an arbitrary shape. Maps, faceting and non-standard scales are supported."
"128","ggblend","images/mjskay-ggblend.png","https://mjskay.github.io/ggblend/","mjskay","ggblend","visualization,blending,affine transformation,layer algebra,compositing","true","mjskay","Algebra of operations for blending, copying, adjusting, transforming, andcompositing ggplot2 layers.","ggblend is a small algebra for manipulating ggplot2 layers (e.g., statsand geoms). It supports copying and adjusting the aesthetics or parametersof an existing layer, partitioning a layer into multiple pieces forre-composition, applying affine transformations to layers, and combininglayers (or partitions of layers) using blend modes (including commutativeblend modes, like multiply and darken). Blend mode support is particularlyuseful for creating plots with overlapping groups where the layer drawingorder does not change the output."
"129","ggflowchart","images/nrennie-ggflowchart.png","https://nrennie.github.io/ggflowchart/","nrennie","ggflowchart","visualization,flowchart,network,diagram","true","nrennie","Create flowcharts using `ggplot2`.","Flowcharts can be a useful way to visualise complex processes. This package uses the layered grammar of graphics of 'ggplot2' to create simple flowcharts. It supports changing the outline and fill colour of nodes based on node attributes, custom node labels, ability to add arrow labels, and tree-based or user-specified layouts. It is compatible with 'ggplot2' functions, and those from existing 'ggplot2' extension packages, allowing extensive customisation."
"130","ggrain","images/ggrain.png","https://github.com/njudd/ggrain","njudd","ggrain","visualization, general","true","njudd","Raincloud geom for 'ggplot2'","Raincloud plots are a visualization tool which puts the raw data next to a box plot and a violin plot.This allows you to immediately visualize the full distribution of your data! Our package offers the function ‘geom_rain()’ to make rainclouds, it can make multiple groups and connect observations over time."
"131","ggoutlierscatterplot","images/ggoutlierscatterplot.png","https://github.com/lukastay/ggoutlierscatterplot","lukastay","ggoutlierscatterplot","visualization,outlier,outliers,scatterplot,algorithms,algorithm,regression","false","lukastay","Visualize multidimensional outlier detection algorithms","Displays scatterplots that visualize outliers.Works with five multidimensional outlier detection algorithms.Higher degrees of abnormality are shown in larger, more red, and less transparent dots."
"132","ggautothemes","images/ggautothemes.png","https://github.com/lukastay/ggautothemes/tree/master","lukastay","ggautothemes","visualization,theme,themeing,color,fill,hue,ggthemes","false","lukastay","Quickly see how different themes will look on your ggplot visual.","Takes in a ggplot visual.Outputs a ""slideshow"" (sleep functions are used to allow time to look upon graphs) that unfolds in your plot pane in RStudio.High quality TIFF raster images can be outputted for professional use."
"133","AMR","images/amr.png","https://msberends.github.io/AMR/","msberends","AMR","visualization,epidemiology,color,fill","true","msberends","Plotting AMR results for SIR categories, MIC values, and disk diffusion diameters","Specialized for visualizing antimicrobial resistance data, it offers intuitive, it offers intuitive, customizable plotsfor SIR categorizations, MIC distributions, and disk diffusion data, simplifying complex microbiological analyses."
"134","ichimoku","images/ichimoku.png","https://shikokuchuo.net/ichimoku/","shikokuchuo","ichimoku","visualization,time-series,finance,trading,candlestick","true","shikokuchuo","Visualization and Tools for Ichimoku Kinko Hyo Strategies","An implementation of ‘Ichimoku Kinko Hyo’, also commonly known as ‘cloud charts’.As described in Sasaki (1996, ISBN:4925152009), the technique is a refinementon candlestick charting, originating from Japan and now in widespread use intechnical analysis worldwide. Translating as ‘one-glance equilibrium chart’, itallows the price action and market structure of financial securities to bedetermined ‘at-a-glance’. "
"135","eheat","images/eheat.png","https://github.com/Yunuuuu/eheat","Yunuuuu","eheat","visualization,heatmap","false","Yunuuuu","Extended ComplexHeatmap with ggplot2","This package serves as a bridge between the ggplot2 and ComplexHeatmap packages. Essentially, all ggplot2 geometries and operations can be utilized in ComplexHeatmap through the eheat package, with the exception of facet operations (and you shouldn’t do it in eheat package). Fortunately, ComplexHeatmapis capable of handling these operations independently, rendering them unnecessary."
"136","ggstats","images/ggstat.png","https://larmarange.github.io/ggstats/","larmarange","ggstats","visualization,p-values,forest plot,geoms,positions,statistics,Likert","true","larmarange","Forest plots of model coefficients, Likert plots and custom proportions","This package provides new statistics, new geometries and new positions for 'ggplot2' and a suite of functions to facilitate the creation of statistical plots such asforest plots of model coefficients, bar plots for Likert-type items, customproportions or survey data."
"137","ggfoundry","images/cgoo4-ggfoundry.png","https://cgoo4.github.io/ggfoundry/","cgoo4","ggfoundry","visualization,geoms,color,fill,shapes","true","cgoo4","Shape Foundry & Geom for 'ggplot2'.","Hand-crafted colourable & fillable shapes."
"138","ggalign","images/ggalign.png","https://yunuuuu.github.io/ggalign/","Yunuuuu","ggalign","visualization,heatmap","true","Yunuuuu","A 'ggplot2' Extension for Consistent Axis Alignment","This package extends ggplot2 by providing advanced tools for aligning and organizing multiple plots, particularly those that automatically reorder observations, such as dendrogram. It offers fine control over layout adjustment and plot annotations, enabling you to create complex, publication-quality visualizations while still using the familiar grammar of ggplot2. "
"139","ggreveal","images/ggreveal.png","https://weverthon.com/ggreveal/","weverthonmachado","ggreveal","visualization,presentation,slides","true","weverthonmachado","Reveal a 'ggplot' Incrementally","Provides functions that make it easy to reveal 'ggplot2' graphsincrementally. The functions take a plot produced with 'ggplot2' andreturn a list of plots showing data incrementally by panels, layers,groups, the values in an axis or any arbitrary aesthetic."
"140","geofacet","images/geofacet_us_unemp.png","https://hafen.github.io/geofacet/","hafen","geofacet","visualization,facet,facets,geo,geography,composition","true","hafen","Easy faceting according to geographic position","This R package provides geofaceting functionality for ggplot2. Geofaceting arranges a sequence of plots of data for different geographical entities into a grid that strives to preserve some of the original geographical orientation of the entities."
"141","tidyplots","images/tidyplots.png","https://tidyplots.org","jbengler","tidyplots","visualization,general,theme,color,statistics","true","jbengler","Tidy plots for scientific papers","The goal of tidyplots is to streamline the creation of publication-ready plots for scientific papers. It allows to gradually add, remove and adjust plot components using a consistent and intuitive syntax."
"142","rphylopic","images/rphylopic.png","https://rphylopic.palaeoverse.org/","palaeoverse","rphylopic","visualization,silhouettes,images,biology","true","willgearty","Get and use silhouettes of organisms from PhyloPic","Work with the PhyloPic Web Service (<http://api-docs.phylopic.org/v2/>) to fetch silhouette images of organisms. Includes functions for adding silhouettes to both base R plots and ggplot2 plots."
"143","deeptime","images/deeptime.png","https://williamgearty.com/deeptime","willgearty","deeptime","visualization,earth sciences,phylogenetics,pattern,color,time-series","true","willgearty","Plotting tools for anyone working in deep time","The primary goal of deeptime is to enable users to add highly customizable timescales to their visualizations. Other functions are also included to assist with other areas of deep time visualization."
