"","name","thumbnail","url","ghuser","ghrepo","tags","cran","ghauthor","short","description"
"1","ggQQunif","images/ggQQunif.png","https://github.com/rcorty/ggQQunif","rcorty","ggQQunif","visualization,quantiles,p-values,statistics,big data","true","rcorty","Make QQ plots for big data expected to be uniformly distributed, e.g. p-values.","For ""big data"" applications, we often have thousands or millions of p-values.The QQ-plot is a standard way to evaluate them, but can be horrifyingly slow when there are many p-values.This package computes where all the points would go in the naive implementation, then thins them strategically to greatly reduce overplotting, resulting in much faster plotting."
"2","ggupset","images/ggupset.png","https://github.com/const-ae/ggupset","const-ae","ggupset","visualization,upset,combination matrix","true","const-ae","Combination Matrix Axis for 'ggplot2' to Create 'UpSet' Plots","Replace the standard x-axis in 'ggplots' with a combination matrixto visualize complex set overlaps. 'UpSet' has introduced a new way to visualizethe overlap of sets as an alternative to Venn diagrams. This package provides a simple way to produce such plots using 'ggplot2'. In addition it can convert any categorical axis into a combinationmatrix axis."
"3","xmrr","images/xmr_chart.png","https://github.com/Zanidean/xmrr","Zanidean","xmrr","XmR, Visualization, Control Charts, QC, XBar","true","Alex Zanidean","Generate XMR Control Chart Data from Time-Series Data.","Use xmr() for XmR data which re-calculates to signal true change, and use xmr_chart() for XmR style control charts with recalculated process limits."
"4","ggpcp","images/ggpcp.png","https://github.com/heike/ggpcp","heike","ggpcp","visualization,parallel coordinate plot,multivariate, categorical","true","heike","Generalized Parallel Coordinate Plots in ggplot2","Parallel coordinate plots (PCP) are good for visualizing observations across multipledimensions by placing variables side-by-side and connecting values from the same observationwith a line segment. Generalized Parallel Coordinate Plots can also seamlessly deal with a mix of categorical and numeric variables in a single plot."
"5","gg3D","images/gg3D.png","https://github.com/AckerDWM/gg3D","AckerDWM","gg3D","3D, Visualization","false","Daniel Acker","3D perspective plots for ggplot2","gg3D adds 3D axes, 3D perspective projections with arbitrary rotations, and 3D wireframe plots to ggplot."
"6","ggQC","images/ggQC.png","https://github.com/kenithgrey/ggQC","kenithgrey","ggQC","QC, XmR, XbarR, SixSigma, Visualization","true","Kenith Grey","Use ggQC to plot single, faceted and multi-layered quality control charts .","ggQC is used to create single, faceted, or multi-layered quality control charts using functions stat_QC(), stat_QC_lines() and stat_mR(). Supported charts include XmR, XbarR, n, c, p, np and more."
"7","ggdist","images/ggdist.png","https://mjskay.github.io/ggdist","mjskay","ggdist","visualization,uncertainty,confidence,probability","true","mjskay","'ggdist' provides stats and geoms for visualizing distributions and uncertainty.","'ggdist' provides stats and geoms for visualizing distributions that are particularly tuned forvisualizing uncertainty in either a frequentist or Bayesian mode. Both analytical distributions (such asfrequentist confidence distributions or Bayesian priors) and distributions represented as samples (such asbootstrap distributions or Bayesian posterior samples) are easily visualized. Visualization primitives includebut are not limited to"
"8","ggedit","images/ggedit.png","https://github.com/metrumresearchgroup/ggedit","metrumresearchgroup","ggedit","visualization, interactive, shiny, general,themes","true","yonicd","ggedit is aimed to interactively edit ggplot layers, scales and themes aesthetics","ggedit is aimed to allows novice and expert ggplot2 users to interactively edit ggplot layers, scales and themes aesthetics, while returning objects and scripts of updated plots using shiny gadgets and modules."
"9","ggpage","images/ggpage.png","https://emilhvitfeldt.github.io/ggpage/","emilhvitfeldt","ggpage","visualization,text","true","emilhvitfeldt","Creates Page Layout Visualizations.","Facilitates the creation of page layoutvisualizations in which words are represented as rectangles with sizesrelating to the length of the words. Which then is divided in linesand pages for easy overview of up to quite large texts."
"10","ggpca","images/ggpca.png","https://cran.r-project.org/web/packages/ggpca/index.html","YaoxiangLi","ggpca","visualization,dimensionality_reduction,PCA,t-SNE,UMAP","true","Yaoxiang Li","Provides tools for creating publication-ready PCA, t-SNE, and UMAP plots.","`ggpca` offers publication-ready dimensionality reduction plots, including Principal Component Analysis (PCA),t-Distributed Stochastic Neighbor Embedding (t-SNE), and Uniform Manifold Approximation and Projection (UMAP). Designed for high-dimensional data visualization, it includes options for custom labels, density plots, and faceting,and is built on the 'ggplot2' framework. Useful for researchers and data scientists in various fields for efficientand insightful data visualization."
"11","ggbreak","images/ggbreak.png","https://github.com/YuLab-SMU/ggbreak","YuLab-SMU","ggbreak","visualization, geoms","true","YuLab-SMU","Set Axis Break for 'ggplot2'","An implementation of scale functions for setting axis breaks of a 'gg' plot."
"12","ggimg","images/ggimg.png","https://github.com/statsmaths/ggimg","statsmaths","ggimg","visualization, geoms","true","statsmaths","Graphics Layers for Plotting Image Data with ggplot2.","Provides two new layer types for displaying image data as layerswithin the Grammar of Graphics framework. Displays images using either arectangle interface, with a fixed bounding box, or a point interface using acentral point and general size parameter. Images can be given as localJPEG or PNG files, external resources, or as a list column containingraster image data."
"13","gganatogram","images/gganatogram.png","https://github.com/jespermaag/gganatogram","jespermaag","gganatogram","anatograms, tissue, visualization, anatomy, expression, pharmacology","false","jespermaag","gganatogram makes it possible to visualise tissues for different organisms or cell compartments.","gganatogram is aimed to users who would like to visualise certain organs or cell compartments based on values, or to highlight tissues. This can be useful when the user easily want to display tissue information e.g. RNA-seq, pharmacology or mutations per tissue."
"14","ggforce","images/ggforce.png","https://github.com/thomasp85/ggforce","thomasp85","ggforce","visualization,general","true","thomasp85","ggforce is aimed at providing missing functionality to ggplot2 through the extension system introduced with ggplot2 v2.0.0.",">"
"15","ggalt","images/ggalt.png","https://github.com/hrbrmstr/ggalt","hrbrmstr","ggalt","visualization,general","true","hrbrmstr","A compendium of ‘geoms’, ‘coords’ and ‘stats’ for ‘ggplot2’.","A compendium of ‘geoms’, ‘coords’ and ‘stats’ for ‘ggplot2’, including splines, 1d and 2d densities, univariate average shifted histograms and a new map coordinate system based on the ‘PROJ.4’-library."
"16","ggiraph","images/ggiraph.png","https://github.com/davidgohel/ggiraph","davidgohel","ggiraph","visualization,general","true","davidgohel","htmlwidget to make 'ggplot' graphics interactive.",">"
"17","ggmuller","images/ggmuller.png","https://cran.r-project.org/web/packages/ggmuller/index.html","robjohnnoble","ggmuller","visualization,evolution,dynamics","true","robjohnnoble","Creates Muller plots for visualizing evolutionary dynamics.","An attempt to set an easy-to-use standard for representing evolutionary dynamics.Should prove useful to researchers in experimental evolution, cancer research, population genetics, and beyond."
"18","ggstance","images/ggstance.png","https://github.com/lionel-/ggstance","lionel-","ggstance","visualization,general","true","lionel-","ggstance implements horizontal versions of common ggplot2 geoms.",">"
"19","ggrepel","images/ggrepel.png","https://github.com/slowkow/ggrepel","slowkow","ggrepel","visualization,general","true","slowkow","Repel overlapping text labels away from each other.",">"
"20","ggraph","images/ggraph.png","https://github.com/thomasp85/ggraph","thomasp85","ggraph","visualization,general","true","thomasp85","ggraph is tailored at plotting graph-like data structures (graphs, networks, trees, hierarchies...).",">"
"21","gginnards","images/gginnards.png","https://docs.r4photobiology.info/gginnards","aphalo","gginnards","visualization,general,layer manipulation,debug","true","aphalo","Find, delete, insert and move plot layers. Delete unused variables from the data stored within a ggplot object. Dump data to the R console.","Package ‘gginnards’ is a set of extensions to R package ‘ggplot2’ (>= 3.0.0). Provides tools making easy to edit and explore ggplot objects.It also provides stats and geom that can be used to dump the data input to geoms and stats to the R console or to summarize it using arbitraryfunctions and then dumping the summary to the R console."
"22","ggpp","images/ggpp.png","https://docs.r4photobiology.info/ggpp","aphalo","ggpp","visualization,general","true","aphalo","Plot annotations, data labels, plot insets, filter labels by local density (geoms, statistics, positions).","Package ‘ggpp’ (Grammar Extensions) is a set of extensions to R package ‘ggplot2’ (>= 3.0.0). Provides `geom_plot()`, `geom_grob()`, `geom_table()` and `stat_fmt_tb()` for insets. Constructors ggplot.ts()` and `ggplot.xts()`. Geometries for margin annotations. Selective annotation of observations in high/low density plot regions and nudging  away from lines or focal points, compatible with `geom_text_repel()` and `geom_label_repel()` from package ‘ggrepel’."
"23","ggpmisc","images/ggpmisc.png","https://docs.r4photobiology.info/ggpmisc","aphalo","ggpmisc","visualization,statistics,general","true","aphalo","Model equation, line, residuals (lm, quantile, MA, rlm, etc.), P, F, AIC, BIC, n, correlation, ANOVA and summary tables, multiple comparisons, peaks and valleys, centroid, data labels.","Package ‘ggpmisc’ (Miscellaneous Extensions to ‘ggplot2’) is a set ofextensions to R package ‘ggplot2’ (>= 3.0.0) with emphasis on annotationsand highlighting related to fitted models and data summaries. scalessuitable for volcano and quadrant plots. Stats for locating peaks andvalleys. See also packages 'gginnards' and 'ggpp' for functions previouslyincluded in 'ggpmisc'."
"24","geomnet","images/geomnet.png","https://github.com/sctyner/geomnet","sctyner","geomnet","visualization,general","false","sctyner","geomnet implements network visualizations in ggplot2 via geom_net.",">"
"25","ggExtra","images/ggExtra.png","https://github.com/daattali/ggExtra","daattali","ggExtra","histogram,marginal,density","true","daattali","ggExtra lets you add marginal density plots or histograms to ggplot2 scatterplots.",">"
"26","ggfortify","images/ggfortify.png","https://github.com/sinhrks/ggfortify","sinhrks","ggfortify","visualization,general","true","terrytangyuan","The unified interface to ggplot2 many popular statistical pakackage results.","Unified plotting tools for statistics commonly used, such as GLM, time series,PCA families, clustering and survival analysis. The package offers a singleplotting interface for these analysis results and plots in a unified styleusing 'ggplot2'."
"27","autoplotly","images/ggfortify.png","https://github.com/terrytangyuan/autoplotly","terrytangyuan","autoplotly","visualization,general","true","terrytangyuan","Automatic generation of interactive visualizations for popular statistical results.","Automatically generate interactive visualizations for popular statistical resultssupported by 'ggfortify', such as time series, PCA, clustering and survival analysis,with 'plotly.js' <https://plot.ly/>  and 'ggplot2' style. The generated visualizationscan also be easily extended using 'ggplot2' and 'plotly' syntax while staying interactive."
"28","gganimate","images/gganimate.gif","https://gganimate.com","thomasp85","gganimate","visualization,general","true","thomasp85","A Grammar of Animated Graphics.","The grammar of graphics as implemented in the 'ggplot2' package hasbeen successful in providing a powerful API for creating static visualisation. In order to extend the API for animated graphics this packageprovides a completely new set of grammar, fully compatible with 'ggplot2' for specifying transitions and animations in a flexible and extensible way."
"29","ggfx","images/ggfx.png","https://ggfx.data-imaginist.com/","thomasp85","ggfx","visualization,general","true","thomasp85","Pixel Filters for 'ggplot2' and 'grid'","Provides a range of filters that can be applied to layers from the 'ggplot2' package and its extensions, along with other graphic elements such as guides and theme elements. The filters are applied at render time and thus uses the exact pixel dimensions needed."
"30","plotROC","images/plotROC.png","https://github.com/sachsmc/plotROC","sachsmc","plotROC","visualization,general","true","sachsmc","plotROC provides functions to generate an interactive ROC curve plot for web use, and print versions.",">"
"31","ggbump","images/ggbump.png","https://github.com/davidsjoberg/ggbump","davidsjoberg","ggbump","visualization,general,geoms","true","davidsjoberg","Bump Chart and Sigmoid Curves.","A geom for ggplot to create bump plots. Can be good to use for showing rank over time."
"32","ggthemes","images/ggthemes.png","https://github.com/jrnold/ggthemes","jrnold","ggthemes","visualization,general,themes","true","jrnold","Some extra geoms, scales, and themes for ggplot.",">"
"33","ggspectra","images/ggspectra.png","https://docs.r4photobiology.info/ggspectra","aphalo","ggspectra","visualization,general","true","aphalo","Plot light-related spectra, peaks, valleys, half maximum, labels with summaries and colours from spectral data (autoplot, stats, geoms, scales).","The goal of ‘ggspectra’ is to make it easy to plot radiation spectra andsimilar data, such and transmittance, absorbance and reflectance spectra,producing fully annotated publication- and presentation-ready plots.Package ‘ggspectra’ provides stats, geoms, scales and functions to beused for plotting radiation-related spectra and annotating the plots withquantities derived from spectral data. All summary quantities implementedin ‘photobiology’ can be used for annotations including biologicallyeffective irradiances and exposures."
"34","ggstatsplot","images/ggstatsplot.png","https://github.com/IndrajeetPatil/ggstatsplot","IndrajeetPatil","ggstatsplot","visualization,statistics","true","IndrajeetPatil","'ggstatsplot' provides a collection of functions to enhance 'ggplot2'plots with results from statistical tests.","Extension of 'ggplot2', 'ggstatsplot' creates graphics withdetails from statistical tests included in the plots themselves. Itprovides an easier syntax to generate information-rich plots forstatistical analysis of continuous (violin plots, scatterplots,histograms, dot plots, dot-and-whisker plots) or categorical (pie andbar charts) data. Currently, it supports the most common types ofstatistical approaches and tests"
"35","ggnetwork","images/ggnetwork.png","https://github.com/briatte/ggnetwork","briatte","ggnetwork","visualization,general","true","briatte","The ggnetwork package provides a way to build network plots with ggplot2.",">"
"36","ggtech","images/ggtech.png","https://github.com/ricardo-bion/ggtech","ricardo-bion","ggtech","visualization,general,themes","false","ricardo-bion","ggplot2 tech themes, scales, and geoms.",">"
"37","ggradar","images/ggradar.png","https://github.com/ricardo-bion/ggradar","ricardo-bion","ggradar","visualization,general","false","ricardo-bion","ggradar allows you to build radar charts with ggplot2.",">"
"38","ggx","images/ggx.png","https://github.com/brandmaier/ggx","brandmaier","ggx","visualization,nlp","true","brandmaier","A Natural Language Interface to 'ggplot2'.","The 'ggplot2' package is the state-of-the-art toolbox for creating and formatting graphs. However, it is easy to forget how certain formatting commands are named and sometimes users find themselves asking"
"39","ggTimeSeries","images/ggTimeSeries.png","https://github.com/Ather-Energy/ggTimeSeries","Ather-Energy","ggTimeSeries","visualization,general","true","Ather-Energy","This R package offers novel time series visualisations.",">"
"40","ggtree","images/ggtree.png","https://guangchuangyu.github.io/ggtree","GuangchuangYu","ggtree","visualization,general","false","GuangchuangYu","gtree is designed for visualizing phylogenetic tree and different types of associated annotation data.",">"
"41","ggseas","images/ggseas.png","https://github.com/ellisp/ggseas","ellisp","ggseas","visualization,general","true","ellisp","Seasonal adjustment on the fly extension for ggplot2.",">"
"42","ggsci","images/ggsci.png","https://nanx.me/ggsci/","road2stat","ggsci","visualization,general","true","road2stat","A collection of ‘ggplot2’ color palettes inspired by scientific journals and science fiction TV shows.",">"
"43","ggmosaic","images/ggmosaic.png","https://github.com/haleyjeppson/ggmosaic","haleyjeppson","ggmosaic","visualization,general","true","haleyjeppson","ggmosaic implements mosaic plots in ‘ggplot2’ via geom_mosaic.",">"
"44","survminer","images/survminer.png","http://www.sthda.com/english/rpkgs/survminer/","kassambara","survminer","visualization,survival","true","kassambara","Drawing Survival Curves using 'ggplot2'","Contains the function 'ggsurvplot()' for drawing easily beautiful and 'ready-to-publish' survival curves with the 'number at risk' table. Other functions are also available for visual examinations of 'cox' model assumptions."
"45","ggeasy","images/ggeasy.png","https://jonocarroll.github.io/ggeasy/","jonocarroll","ggeasy","visualization,teaching","true","jonocarroll","Easy Access to 'ggplot2' Commands","Provides a series of aliases to commonly used but difficult to remember 'ggplot2' sequences."
"46","ggside","images/ggside.png","https://github.com/jtlandis/ggside","jtlandis","ggside","visualization,correlation","true","jtlandis","Side Grammar Graphics","The grammar of graphics as shown in 'ggplot2' has providedan expressive API for users to build plots. 'ggside' extends 'ggplot2' by allowing users to add graphical information about one of the main panel'saxis using a familiar 'ggplot2' style API with tidy data. This package isparticularly useful for visualizing metadata on a discrete axis, or summarygraphics on a continuous axis such as a boxplot or a density distribution."
"47","ggcorrplot","images/ggcorrplot.png","https://rpkgs.datanovia.com/ggcorrplot/","kassambara","ggcorrplot","visualization,correlation","true","kassambara","Visualization of a correlation matrix using 'ggplot2'","The 'ggcorrplot' package can be used to visualize easily acorrelation matrix using 'ggplot2'. It provides a solution for reordering thecorrelation matrix and displays the significance level on the plot. It alsoincludes a function for computing a matrix of correlation p-values."
"48","ggpubr","images/ggpubr.png","https://rpkgs.datanovia.com/ggpubr/","kassambara","ggpubr","visualization,statistics","true","kassambara","‘ggplot2’ Based Publication Ready Plots","The 'ggplot2' package is excellent and flexible for elegant datavisualization in R. However the default generated plots requires some formattingbefore we can send them for publication. Furthermore, to customize a 'ggplot',the syntax is opaque and this raises the level of difficulty for researcherswith no advanced R programming skills. 'ggpubr' provides some easy-to-usefunctions for creating and customizing 'ggplot2'- based publication ready plots."
"49","ggthemr","images/cttobin-ggthemr.png","https://github.com/cttobin/ggthemr","cttobin","ggthemr","visualization,general,themes","false","cttobin",">","Themes for ggplot. The idea of this package is that you can just set the theme and then forget about it. You should not have to change any of your existing code."
"50","GGally","images/ggally.png","https://ggobi.github.io/ggally/","ggobi","ggally","visualization,general","true","ggobi"," ggally extends 'ggplot2' by adding several functions to reduce the complexity of combining geometric objects with transformed data."," ggplot2 is a plotting system based on the grammar of graphics. 'GGally' extends 'ggplot2' by adding several functions to reduce the complexity of combining geometric objects with transformed data. Some of these functions include a pairwise plot matrix, a two group pairwise plot matrix, a parallel coordinates plot, a survival plot, and several functions to plot networks."
"51","ggseqlogo","images/ggseqlogo.png","https://github.com/omarwagih/ggseqlogo","omarwagih","ggseqlogo","visualization,general","true","omarwagih"," Publication-ready sequence logos using ggplot2."," ggseqlogo extends 'ggplot2' allowing users to flexibily plot sequence logos."
"52","ggChernoff","images/ggChernoff.png","https://github.com/Selbosh/ggChernoff","Selbosh","ggChernoff","visualization","true","Selbosh"," Visualise multivariate data using human faces"," Adds geoms, scales and aesthetics to plot 'Chernoff' faces that vary their expression according to your data. Make your data smile or frown, angry or straight-faced, with continuous scales and legend support."
"53","ggridges","images/ggridges.png","https://cran.r-project.org/web/packages/ggridges/vignettes/introduction.html","clauswilke","ggridges","visualization,general","true","clauswilke","Ridgeline plot geoms for 'ggplot2'","Ridgeline plots provide a convenient way of visualizing changes in distributions over time or space. This package enables the creation of such plots in 'ggplot2'."
"54","lemon","images/lemon.png","https://github.com/stefanedwards/lemon","stefanedwards","lemon","visualization,brackets,axis","true","stenfanedwards","Repositioning legends and adding brackets to axes to 'ggplot2'.","Functions for working with legends and axis lines of 'ggplot2', facets that repeat axis lines on all panels, and some 'knitr' extensions."
"55","cowplot","images/cowplot.png","https://cran.r-project.org/web/packages/cowplot/vignettes/introduction.html","wilkelab","cowplot","visualization,general,themes","true","clauswilke","Streamlined plot theme and plot annotations for 'ggplot2'","The package provides a streamlined and clean theme that is used in the Wilke lab, hence the package name, which stands for Claus O. Wilke's plot package. The package also provide functionality to combine multiple 'ggplot2' plots into one, align them, and label them with letters, e.g. A, B, C, etc., as is often required for scientific publications."
"56","qqplotr","images/qqplotr.png","https://github.com/aloy/qqplotr","aloy","qqplotr","quantile-quantile,probability-probability","true","almeidaxan","Quantile-quantile and probability-probability plot extensions for 'ggplot2'","The package extends some 'ggplot2' functionalities by permitting the drawing of quantile-quantile (Q-Q) and probability-probability (P-P) points, lines, and confidence bands. The functions of this package also allow the detrend adjustment, previously proposed in the literature to help reduce visual bias when assessing those type of plots."
"57","ggalluvial","images/ggalluvial.png","https://github.com/corybrunson/ggalluvial","corybrunson","ggalluvial","visualization,categorical,time series","true","corybrunson","A 'ggplot2' extension for alluvial diagrams.","Alluvial diagrams encompass a variety of charts that use x-splines (alluvia and flows), sometimes augmented with stacked bars (lodes or strata), to visualize incidence structures derived from several data types, including repeated categorical measures, evolving classifications, and multi-dimensional categorical data. This package contains stats and geoms that interpret multiple data formats compatible with this framework while hewing to the principles of tidy data and the grammar of graphics."
"58","patchwork","images/thomasp85-patchwork.png","https://github.com/thomasp85/patchwork#patchwork","thomasp85","patchwork","visualization,composition","true","thomasp85","Easy composition of ggplot plots using arithmetic operators","ggplot2 is concerned with single plots, facets notwithstanding, and does not provide a native way to compose multiple plots. patchwork extends the standard ggplot2 API to allow composition with the '+' operator as well as other the means to customize the layout and nest sub-arrangements."
"59","ggquiver","images/ggquiver.png","https://github.com/mitchelloharawild/ggquiver","mitchelloharawild","ggquiver","visualization,quiver,velocity,vector","true","mitchelloharawild","Quiver/velocity plots for 'ggplot2'.","Quiver plots are common a common visualisation method for vector fields. 'ggquiver' provides a new geom which simplifies the creation of these plots, with scaling and centering functionality."
"60","ggsignif","images/ggsignif.png","https://github.com/const-ae/ggsignif","const-ae","ggsignif","visualization,multiple comparisons","true","const-ae and IndrajeetPatil","Significance Brackets for 'ggplot2'.","Enrich your 'ggplots' with group-wise comparisons.This package provides an easy way to indicate if two groups aresignificantly different. Commonly this is shown by a bracket on topconnecting the groups of interest which itself is annotated with thelevel of significance (NS, *, **, ***).  The package provides a singlelayer (geom_signif()) that takes the groups for comparison and thetest (t.test(), wilcox.text() etc.) as arguments and adds theannotation to the plot."
