"","name","thumbnail","url","ghuser","ghrepo","tags","cran","ghauthor","short","description"
"61","ggdag","images/ggdag.png","https://ggdag.malco.io/","malcolmbarrett","ggdag","visualization,dags,inference","true","malcolmbarrett","Causal directed acyclic graphs (DAGs) in `ggplot2`","Tidy, visualize, and analyze causal DAGs. `ggdag` fuses the `dagitty` package, which contains powerful algorithms for analyzing causal diagrams, with the flexibility of `ggplot2` and `ggraph`."
"62","ggformula","images/projectmosaic-ggformula.png","https://projectmosaic.github.io/ggformula/","ProjectMOSAIC","ggformula","visualization,general,interface","true","rpruim","`ggplot2` via formulas and pipes","`ggformula` provides a formula-based interface for `ggplot2` that uses pipes (`%>%`) for layering."
"63","ggbeeswarm","images/ggbeeswarm.png","https://github.com/eclarke/ggbeeswarm","eclarke","ggbeeswarm","visualization, beeswarm, categorical","true","Erik Clarke and Scott Sherrill-Mix","Create beeswarm plots, which avoids overlapping datapoints.","Beeswarm plots (aka column scatter plots or violin scatter plots) are a way of plotting points that would ordinarily overlap so that they fall next to each other instead. In addition to reducing overplotting, it helps visualize the density of the data at each point (similar to a violin plot), while still showing each data point. `ggbeeswarm `provides two different methods to create beeswarm-style plots using ggplot2. `geom_quasirandom()` uses a van der Corput sequence or Tukey texturing  o space the dots to avoid overplotting. `geom_beeswarm()` uses the Aron Ecklund's `beeswarm` library to do point-size based offset."
"64","ggperiodic","images/ggperiodic-cos.png","https://github.com/eliocamp/ggperiodic","eliocamp","ggperiodic","visualization,periodic","true","eliocamp","Automagically augment periodic data in `ggplot2`","Allows you to wrap periodic data to any arbitrary domain automatically inside the ggplot2 call."
"65","ggpol","images/erocoar-ggpol.png","https://github.com/erocoar/ggpol","erocoar","ggpol","visualization,general","true","erocoar","ggpol adds parliament diagrams and several other geoms to ggplot2.",">"
"66","ggpirate","images/ggpirate.png","https://github.com/mikabr/ggpirate","mikabr","ggpirate","visualization","false","mikabr","Pirate plots for `ggplot2`","A pirate plot (as seen in Nathaniel Phillips's package `yarrr`) is a way of displaying data where a continuous dependent variable is a function of a categorical independent variable, in a more informative way than the traditional barplot. `ggpirate` creates customizable versions of these plots with a single `ggplot2` `geom`, `geom_pirate`."
"67","esquisse","images/esquisse.png","https://github.com/dreamRs/esquisse","dreamrs","esquisse","visualization,interface","true","dreamrs","Explore and Visualize Your Data Interactively with `ggplot2`","A 'shiny' gadget to create 'ggplot2' charts interactively with drag-and-drop to map your variables. You can quickly visualize your data accordingly to their type, export to 'PNG' or 'PowerPoint', and retrieve the code to reproduce the chart."
"68","ggdark","images/nsgrantham-ggdark.png","https://github.com/nsgrantham/ggdark","nsgrantham","ggdark","visualization,general,themes","true","nsgrantham","Dark Mode for `ggplot2` Themes","Activate dark mode on your favorite `ggplot2` theme with `dark_mode()` or use the dark versions of native `ggplot2` themes, including `dark_theme_gray()`, `dark_theme_minimal()`, and others."
"69","sugrrants","images/sugrrants.png","https://pkg.earo.me/sugrrants","earowang","sugrrants","visualization,calendar,time-series","true","earowang","Supporting Graphs for Analysing Temporal Data with `ggplot2`.","Provides 'ggplot2' graphics for analysing temporal data. It aims tofit into the 'tidyverse' and grammar of graphics framework for handlingtemporal data."
"70","tvthemes","images/ryo-n7-tvthemes.png","https://github.com/Ryo-N7/tvthemes","Ryo-N7","tvthemes","visualization,general,palettes,themes","true","Ryo-N7","`ggplot2` Themes & Palettes from popular TV shows!","Contains various `ggplot2` themes and color palettes based on TV showssuch as 'Game of Thrones', 'Brooklyn Nine-Nine', 'The Simpsons','Avatar"
"71","ggfittext","images/ggfittext.png","https://wilkox.org/ggfittext","wilkox","ggfittext","visualization,general,text","true","wilkox","`ggplot2` geoms to fit text in a box","Provides `ggplot2` geoms for automatically resizing and reflowing text tofit in a defined area, including bar and column plots."
"72","ggparty","images/martin-borkovec-ggparty.png","https://github.com/martin-borkovec/ggparty","martin-borkovec","ggparty","visualization,tree,partykit","true","martin-borkovec","`ggplot2` visualizations for the `partykit` package","ggparty aims to extend ggplot2 functionality to the partykit package.It provides the necessary tools to create clearly structured and highly customizable visualizationsfor tree-objects of the class 'party'"
"73","gggenes","images/gggenes.png","https://wilkox.org/gggenes","wilkox","gggenes","visualization,general,genetics","true","wilkox","`ggplot2` geoms to draw gene arrow maps","Provides a 'ggplot2' geom and helper functions for drawing gene arrowmaps, including labelling genes and highlighting subgene regions."
"74","gggenomes","images/gggenomes.png","https://thackl.github.io/gggenomes","thackl","gggenomes","visualization,genetics,genomics","true","thackl","a grammar of graphics for comparative genomics","a `ggplot2`-based versatile graphics package for comparative genomics adding dedicated layers for genes, mappings, syntenic regions, ..., and verbs to for example quickly zoom into gene neighborhoods."
"75","treemapify","images/treemapify.png","https://wilkox.org/treemapify","wilkox","treemapify","visualization,general,treemap","true","wilkox","Draw treemaps in `ggplot2`","Provides `ggplot2` geoms for drawing treemaps, including text labels andup to three levels of nested groups."
"76","lindia","images/lindia.png","https://github.com/yeukyul/lindia","yeukyul","lindia","visualization,general,diagnostics,regression","true","yeukyul","Create diagnostics plots for linear regression","Using `lindia` (short for linear-regression diagnostics), you cancreate all the basic diagnostic plots for a linear regression modelin `ggplot2` with just one function call."
"77","gghalves","images/erocoar-gghalves.png","https://github.com/erocoar/gghalves","erocoar","gghalves","visualization,general","true","erocoar","gghalves adds half-geoms to `ggplot2`.","`gghalves` makes it easy to compose your own half-half plots via `ggplot2`. Think displaying a boxplot next to jittered points, or violin plots side by side with dotplots."
"78","ggrastr","images/vpetukhov-ggrastr.png","https://github.com/VPetukhov/ggrastr","vpetukhov","ggrastr","visualization,raster","true","vpetukhov","Rasterize only specific layers of your plot","`ggrastr` provides set of geoms to rasterize only specific layers of the plot (e.g. large scatterplots)keeping all labels and text in vector format. Allows to keep your plots within the reasonable size limit withoutloosing vector properties of the scale-sensitive information."
"79","ggpointdensity","images/lkremer-ggpointdensity.png","https://github.com/LKremer/ggpointdensity","LKremer","ggpointdensity","visualization,general","true","LKremer","Introduces `geom_pointdensity()`","There are several ways to visualize data points on a 2D coordinate system"
"80","ggsom","images/ggsom.png","https://github.com/oldlipe/ggsom","oldlipe","ggsom","visualization,SOM,multi-dimensional,parallel-coordinates","true","oldlipe","The aim of this package is to offer more variability of graphics based on the self-organizing maps.","Analysis of multidimensional and time series data is useful and pertinent to several different applications, being a challenge due to the volume and complexity of the data.A possible approach for analysis of this kind of data is use clustering algorithms to reduce the dimensionality of the data.This package uses Self-Organizing Map to data dimensionality reduction. Use geom_class() to visualization in parallelel coordinates each neuron of the Self-Organizing Maps."
"81","ggnewscale","images/ggnewscale.png","https://github.com/eliocamp/ggnewscale","eliocamp","ggnewscale","visualization,general,scales","true","eliocamp","Use multiple fill and colour scales in 'ggplot2'.","Attempts to solve the lack of multiple colour scales in ggplot2 using a intuitive and familiar interface."
"82","ggh4x","images/teunbrand-ggh4x.png","https://teunbrand.github.io/ggh4x/","teunbrand","ggh4x","visualization,general,scales,facets","true","teunbrand","Options for tailored facets, multiple colourscales and miscellaneous","Expands options for facetted plots, including nested facets, adjusting sizes and facet-wise position scales.Also hosts a small selection of geoms, stats and positions."
"83","ggarrow","images/teunbrand-ggarrow.png","https://teunbrand.github.io/ggarrow/","teunbrand","ggarrow","visualization, arrows, lines","true","teunbrand","Arrow geoms and arrow theme element with customisation options","ggarrow provides a rich variant of paths with arrows. It includes optionsfor variable-width paths, customisable arrow heads, endpoint dodging, and placing arrow heads along the path."
"84","legendry","images/teunbrand-legendry.png","https://github.com/teunbrand/legendry","teunbrand","legendry","visualization, guide, legend, axis","true","teunbrand","Extended legends and axes","A ggplot2 extension that focusses on expanding the plotter's arsenal of guides. Guides in ggplot2 include axes and legends. legendry offers new axes and annotation options, as well as new legends and colour displays."
"85","ggcharts","images/ggcharts.png","https://thomas-neitmann.github.io/ggcharts/index.html","thomas-neitmann","ggcharts","visualization,general","true","thomas-neitmann","Shorten the distance from data visualization idea to actual plot","ggcharts provides a high-level ggplot2 interface for creating common charts. Its aim is both simple and ambitious:shorten the distance from data visualization idea to actual plot. How so? By taking care of a lot of data preprocessing,obscure ggplot2 details and plot styling for you. The resulting plots are ggplot objects and can be further customizedusing any ggplot2 function."
"86","humapr","images/humapr.png","https://github.com/benskov/humapr","benskov","humapr","visualization,general,tabulation,choropleth","false","benskov","Visualise topographic human data with choropleths","Several domains deal with topographic human data, both exterior on the body surface (e.g., injury research) andinterior (e.g., forensic pathology). This package seeks to offer a straightforward API for visualising such data.For now, the package offers two maps"
"87","ggshadow","images/ggshadow.png","https://github.com/marcmenem/ggshadow","marcmenem","ggshadow","visualization,general","true","marcmenem","Draw a shadow below lines to make busy plots more aesthetically pleasing","A collection of geoms for R's 'ggplot2' library. geom_shadowpath(), geom_shadowline(),geom_shadowstep() and geom_shadowpoint() functions draw a shadow below lines to makebusy plots more aesthetically pleasing. geom_glowpath(), geom_glowline(), geom_glowstep()and geom_glowpoint() add a neon glow around lines to get a steampunk style. "
"88","ggseg","images/ggseg-ext.png","https://github.com/LCBC-UiO/ggseg","LCBC-UiO","ggseg","visualization,brain imaging","true","Athanasiamo","Draw polygons of brain atlas segmentations","In neuroimaging, it is common to segment the brain intofinite smaller number of regions that share some property(function, neuroanatomy etc). `ggseg()` makes it possibleto visualize these segmentations using polygons."
"89","mdthemes","images/mdthemes.png","https://github.com/thomas-neitmann/mdthemes","thomas-neitmann","mdthemes","visualization,themes","false","thomas-neitmann","'ggplot2' themes that render text as markdown/HTML","`{mdthemes}` provides themes that render text as markdown/HTML. This enablesmaking individual words bold or italics as well as coloring them."
"90","ggwordcloud","images/ggwordcloud.png","https://lepennec.github.io/ggwordcloud/","lepennec","ggwordcloud","visualization,text","true","lepennec","A word cloud text geom for 'ggplot2'.","`ggwordcloud` provides a word cloud text geom for `ggplot2`.The placement algorithm implemented in C++ is an hybrid between the one of `wordcloud`and the one of `wordcloud2.js`. The cloud can grow according to a shape and stay within a mask.The size aesthetic is used either to control the font size or the printed area of the words.`ggwordcloud` also supports arbitrary text rotation. The faceting scheme of `ggplot2` can also be used.Two functions meant to be the equivalent of `wordcloud` and `wordcloud2` are proposed.Last but not least you can use `gridtext` markdown/html syntax in the labels."
"91","ggasym","images/ggasym.png","https://jhrcook.github.io/ggasym/index.html","jhrcook","ggasym","visualization,multi-dimensional,matrix,scales","false","jhrcook","Asymmetric matrix plotting with multiple scales.","‘ggasym’ plots a symmetric matrix with three different fill aesthetics for the top-left and bottom-right triangles and along the diagonal.It operates within the Grammar of Graphics paradigm implemented in ‘ggplot2’."
"92","gglorenz","images/gglorenz.png","https://github.com/jjchern/gglorenz","jjchern","gglorenz","visualization,general,statistics","true","jjchern","Plotting Lorenz curves with the blessing of ggplot2.","`gglorenz` provides statistical transformations for plotting empirical ordinary Lorenz curve (Lorenz 1905) <doi:10.2307/2276207> and generalized Lorenz curve (Shorrocks 1983) <doi:10.2307/2554117>."
"93","hrbrthemes","images/hrbrmstr-hrbrthemes.png","https://github.com/hrbrmstr/hrbrthemes","hrbrmstr","hrbrthemes","theme,typography","true","hrbrmstr","A compilation of extra {ggplot2} themes, scales and utilities, including a spell check function for plot label fields and an overall emphasis on typography.","`hrbrthemes` is a very focused package that provides typography-centric themes and theme components for ggplot2.The core theme"
"94","ggpattern","images/ggpattern.png","https://github.com/trevorld/ggpattern","trevorld","ggpattern","visualization,pattern","true","coolbutuseless","Pattern fills for ggplot2 geoms.","`ggpattern` provides geoms to use within ggplot which can be filled with patterns.Supported patterns include stripes, dots, checks, image files, gradients, etc."
"95","ggtext","images/ggtext.png","https://wilkelab.org/ggtext/","clauswilke","ggtext","general,theme,typography","true","Claus Wilke","Improved text rendering support for `ggplot2`","`ggtext` provides simple Markdown and HTML rendering for ggplot2."
"96","calendR","images/calendR.png","https://r-coder.com/calendar-plot-r/","R-CoderDotCom","calendR","visualization, calendar, time-series","true","R-CoderDotCom","Ready to Print Monthly and Yearly Calendars","Contains the function calendR() for creating fully customizable monthly and yearly calendars (colors, fonts, formats, ...) and even heatmap calendars.In addition, it allows saving the calendars in ready to print A4 format PDF files."
"97","ggip","images/ggip.png","https://davidchall.github.io/ggip/","davidchall","ggip","visualization, cyber, space-filling curves","true","davidchall","Data visualization of IP addresses and networks","`ggip` provides a coordinate system that maps IP data to the 2D grid, usinga space-filling curve (either the Hilbert or Morton curve). This data canthen be used with regular `ggplot2` layers or with custom `ggip` layers."
"98","gglm","images/gglm.png","https://graysonwhite.github.io/gglm/","graysonwhite","gglm","visualization,modeling,diagnostic","true","graysonwhite","Grammar of Graphics for linear model diagnostic plots.","`gglm`, The Grammar of Graphics for Linear Model Diagnostics, is a package thatcreates beautiful `ggplot2` diagnostic plots for linear models that are easy to useand adhere to The Grammar of Graphics. The purpose of this package is to provide asensible alternative to using the base-R `plot()` function to produce diagnostic plotsfor linear models."
"99","econocharts","images/econocharts.png","https://r-coder.com/economics-charts-r/","R-CoderDotCom","econocharts","economics, microeconomics, macroeconomics","false","R-CoderDotCom","Microeconomics and Macroeconomics Charts","Contains several functions for creating fully-customizable microeconomics or macroeconomics charts,such as supply and demand curves, indifference curves, production-possibility frontiers or Laffer curves."
"100","ComplexUpset","images/krassowski-complex-upset.png","https://github.com/krassowski/complex-upset","krassowski","complex-upset","visualization,venn,set,intersections,venn-diagram,upset","true","krassowski","Visualize set intersections and add `ggplot2` annotations","UpSet plots are an improvement over Venn Diagram for set overlap visualizations.Striving to bring the best of the 'UpSetR' and 'ggplot2', this package offers a way to createcomplex overlap visualisations, using simple and familiar tools, i.e. geoms of 'ggplot2'.For introduction to UpSet concept, see Lex et al. (2014)."
"101","ggchromatic","images/teunbrand-ggchromatic.png","https://teunbrand.github.io/ggchromatic/","teunbrand","ggchromatic","visualization,scales","false","teunbrand","Colourspace Scales for 'ggplot2'","The 'ggchromatic' package provides additional colour and fill scales to use with 'ggplot2'. Using the 'ggplot2' extension system, so called chromatic scales are introduced that map a mix of continuous and discrete variables to the channels of different colour spaces. "
"102","ggheatmap ","images/ggheatmap.png","https://github.com/XiaoLuo-boy/ggheatmap","XiaoLuo-boy","ggheatmap","visualization, heatmap","true","XiaoLuo-boy","ggplot2 version of heatmap","The flexibility and excellence of 'ggplot2' is unquestionable, so many drawing tools basically need 'ggplot2' as the operating object. In order to develop a heatmap drawing system based on ggplot2, we developed this tool, mainly to solve the heatmap puzzle problem and the flexible connection between the heatmap and the 'ggplot2' object. The advantages of this tool are as follows"
"103","see","images/see.png","https://github.com/easystats/see","easystats","see","visualizations,statistics","true","easystats","Visualisation Toolbox for 'easystats' and Extra Geoms, Themes and Color Palettes for 'ggplot2'","Provides plotting utilities supportingeasystats-packages (<https://github.com/easystats/easystats>) and someextra themes, geoms, and scales for 'ggplot2'. Color scales are basedon <https://www.materialui.co/colors>."
"104","directlabels","images/directlabels.png","http://tdhock.github.io/directlabels","tdhock","directlabels","visualization, direct-labels, positioning, general, plot-labelling","true","tdhock","Framework for adding direct labels to lattice or ggplot2 plots.","Modern plotting packages like lattice and ggplot2 show automatic legends based on the variable specified for color, but these legends can be oftenconfusing if there are too many colors. To help with this, the directlabelspackage provides direct variable-labelling on intuitively placed positionswhich are a useful, clear and more attractive alternative to those confusing legends observed in many common plots."
"105","ggHoriPlot","images/ggHoriPlot.png","https://github.com/rivasiker/ggHoriPlot","rivasiker","ggHoriPlot","visualization,general,horizon-plot,time-series","true","rivasiker","Horizon Plots for `ggplot2`","`ggHoriPlot` is a user-friendly, highly customizable R package for buildinghorizon plots in `ggplot2`, where both the origin of the horizon plot and the cutpoints of the different intervals can be user-speficied for greater flexibility. "
"106","ggtrace","images/ggtrace.png","https://rnabioco.github.io/ggtrace/","rnabioco","ggtrace","visualization","true","sheridar","Outline groups of data points using ggplot2",">    Provides 'ggplot2' geoms that allow groups of data points to be outlined orhighlighted for emphasis. This is particularly useful when working with densedatasets that are prone to overplotting."
"107","ggESDA","images/ggESDA.png","https://github.com/kiangkiangkiang/ggESDA","kiangkiangkiang","ggESDA","visualization,symbolic data,interval-valued data","true","kiangkiangkiang","Exploratory Symbolic Data Analysis with 'ggplot2'."," The 'ggESDA' package provides the advanced graphic techniques including the  multivariate visualization, exhibition with modal multi-valued and interval-valued, and classification by color mapping. Also, summarize the classical data into symbolic data by various customized method."
"108","geomtextpath","images/geomtextpath.png","https://allancameron.github.io/geomtextpath/","AllanCameron","geomtextpath","typography,plot-labelling,visualization","true","AllanCameron","Create curved text and directly label lines in `ggplot`","Directly labelling your plots with text that follows the curves of your data not only makes for a pretty plot. It can function as an alternative to a legend, freeing up valuable space, and makes plots easier for a general audience to understand. With support for bidirectional text,richtext, plotmath and even simple feature (sf) maps, `geomtextpath`aims to make annotating plots simple and accessible."
"109","ggdensity","images/ggdensity.png","https://jamesotto852.github.io/ggdensity","jamesotto852","ggdensity","visualization,density-estimation","true","jamesotto852","Interpretable bivariate density visualization with highest density regions","`ggdensity` provides `geom_hdr()` and `geom_hdr_lines()` as drop-inreplacements for `ggplot2` functions `geom_density_2d_filled()` and`geom_density_2d()`, facilitating the plotting of highest density regions (HDRs) in place of arbitrary density contours. A variety of statisticallyrigorous density estimators are available, as well as helper functions`geom_hdr_fun()` and `geom_hdr_lines_fun()` for plotting HDRs of (potentially un-normalized) user-specified bivariate probability density functions."
"110","ggtranscript","images/dzhang32-ggtranscript.png","https://dzhang32.github.io/ggtranscript/","dzhang32","ggtranscript","visualization,genetics,genomics,transcripts,annotation","false","dzhang32","Visualizing transcript structure and annotation using `ggplot2`","The goal of ggtranscript is the simplify the process of visualizing transcript structure and annotation. To achieve this, ggtranscript introduces 5 new geoms (geom_range(), geom_half_range(), geom_intron(), geom_junction() and geom_junction_label_repel()) as well as several helperfunctions. As a ggplot2 extension, ggtranscript inherits ggplot2's familiarity and flexibility, enabling users to intuitively adjust aesthetics, parameters, scales etc as well as complement ggtranscript geoms with existing ggplot2 geoms to create informative, publication-ready plots."
"111","piecepackr","images/piecepackr-piecepackr.png","https://trevorldavis.com/piecepackr","piecepackr","piecepackr","board games, geoms","true","trevorld","Board game graphics","  Functions to make board game graphics with the 'ggplot2', 'grid', 'rayrender', 'rayvertex', and 'rgl' packages.  Specializes in game diagrams, animations, and ""Print & Play"" layouts for the 'piecepack' <https://www.ludism.org/ppwiki> but can make graphics for other board game systems.  Includes configurations for several public domain game systems such as checkers, (double-18) dominoes, go, 'piecepack', playing cards, etc."
"112","oblicubes","images/trevorld-oblicubes.png","https://trevorldavis.com/R/oblicubes","trevorld","oblicubes","visualization, geoms","true","trevorld","3D Rendering Using Obliquely Projected Cubes and Cuboids","  Three-dimensional rendering for 'grid' and 'ggplot2' graphics using cubes and cuboids drawn with an oblique projection.  As a special case also supports primary view orthographic projections.  Can be viewed as an extension to the 'isocubes' package <https://github.com/coolbutuseless/isocubes>."
"113","ggDoubleHeat","images/ggdoubleheat.png","https://github.com/PursuitOfDataScience/ggDoubleHeat","PursuitOfDataScience","ggDoubleHeat","visualization, geoms","true","PursuitOfDataScience","A heatmap-like visualization tool","A data visualization design that provides comparison between two (Double) data sources (usually on a par with each other) on one reformed heatmap, while inheriting 'ggplot2' features.  "
"114","nflplotR","images/nflplotR.png","https://nflplotr.nflverse.com","nflverse","nflplotR","general,scales,geoms,images,theme,elements","true","mrcaseb","'nflplotR' provides a set of functions to visualize National Football League analysis in 'ggplot2'.","The goal of 'nflplotR' is to provide functions and geoms that help visualization of images and NFL related analysis. It provides 'ggplot2' geoms and theme elements that do the heavy lifting of plotting images in high quality, with correct aspect ratio and other image modification functions."
"115","ggbraid","images/ggbraid.png","https://nsgrantham.github.io/ggbraid","nsgrantham","ggbraid","visualization,general,geoms","false","nsgrantham","Braid ribbons in `ggplot2`.","ggbraid provides a new stat, `stat_braid()`, that extends the functionality of `geom_ribbon()` to correctlyfill the area between two alternating lines (or steps) with two different colors. ggbraid also providesa geom, `geom_braid()`, that wraps `geom_ribbon()` and uses `stat_braid()` by default."
"116","ggblanket","images/ggblanket.png","https://davidhodge931.github.io/ggblanket/articles/ggblanket.html","davidhodge931","ggblanket","visualization","true","davidhodge931","Simplify ggplot2 visualisation","Simplify ggplot2 visualisation with ggblanket wrapper functions.  "
